name,street_address,google_map,review_count,phone,website,restaurant_type,average_review,food_review,service_review,ambience_review,value_review,price_range,star_1,star_2,star_3,star_4,star_5,description,restaurant_main_type,latitude,longitude,postal_code1 Darbar,"152 E 46th Street New York, NY  10017",//www.google.com/maps/search/?api=1&query=40.7540000%2C-73.974,516,(212) 681-4500,http://www.darbarny.com/,Indian,4.4516,4.4,4.2,3.9,4.2,$30 and under,0,4,8,33,55,"Reviewers and patrons consistently give high marks to this cozy, bi-level restaurant & lounge. Highly Zagat rated, 1 Darbar is a superb choice for Indian food with great ambiance and service. A lavish $10.95 lunch buffet with new and delicious dishes served everyday. Dinner from $10 and up. We look forward to seeing you soon.",Indian,40.7535116,-73.9735331,10017Zio Ristorante,"17 West 19th St. New York, NY  10011",//www.google.com/maps/search/?api=1&query=40.7395650%2C-73.992479,546,(212) 352-1700,http://www.zio-nyc.com/,Italian,4.6546,4.5,4.6,4.5,4.4,$31 to $50,1,3,4,24,68,"Zio Ristorante offers authentic Italian cuisine in an inviting setting where casual comfort meets dining elegance. Named for the Italian word for uncle (“because when you go to your uncle’s house, he takes good care of you”), restaurant guests will feel the warm embrace of home in the hospitality of the staff and in the bursting flavors of the fabulous menu. Homemade pastas, superbly fresh seafood and meat dishes, a monthly $20 three-course lunch and a Happy Hour menu almost too good to be true highlight the contented, well-fed experience at this popular find at the crossroads of the Flatiron District, Chelsea and Union Square. Gluten-free and vegetarian options are available, brunch is served on weekends and there is a truly fantastic private dining room for parties, special events and occasions. ",Italian,40.7396687,-73.9924795,10011Meet the Meat,"23-92 21st Street Astoria, NY  11105",//www.google.com/maps/search/?api=1&query=40.7771740%2C-73.921291,191,(917) 832-7984,http://meetthemeat.net/,Steakhouse,4.8191,4.7,4.8,4.6,4.5,$31 to $50,0,2,2,14,82,"Meet the Meat is a steakhouse located in the heart of Astoria. Using the finest quality meats we prepare a variety of cuts such as filet mignon, porter house, ribeye , prime sirloin, and sliced steak. Our specialty is steaks, but we also serve a selection of other fine dishes such as lamb chops, grilled chicken breast, salmon, branzino, as well as burgers and pasta options. It's our goal to grill the most delectable steaks in Astoria with a commitment to freshness and flavor in every bite. Your complete satisfaction is our top priority here at Meet the Meat. We welcome you into our cozy and relaxing restaurant to enjoy a meal with friends, family, or that special someone. Come savor one of our delicious, juicy steaks. We promise you will leave our restaurant happy and full.",Steakhouse,40.7770481,-73.9214503,11105The Morgan Dining Room,"225 Madison Avenue New York, NY  10016",//www.google.com/maps/search/?api=1&query=40.7492090%2C-73.981526,351,(212) 683-2130,http://www.themorgan.org/dining,American,4.4351,4.2,4.4,4.5,4,$30 and under,1,3,10,24,62,"The Morgan Dining Room's menu draws inspiration from early-twentieth-century New York City cuisine. Guests dine in the original Morgan family dining room, located in the restored nineteenth-century brownstone",American,40.7492094,-73.9815265,10016Montebello Ristorante Italiano,"120 E. 56th St. New York, NY  10022",//www.google.com/maps/search/?api=1&query=40.7604910%2C-73.970195,612,(212) 753-1447,http://www.montebellonyc.com/,Italian,4.4612,4.3,4.6,4.1,3.9,$31 to $50,0,0,15,31,54,"Located in the heart of Midtown East, Montebello serve a classic Northern Italian cuisine with a special flair for a business lunch or a romantic dinner. Emphasis is placed on simple, fresh ingredients and proven cooking methods. The service is warm and attentive, the decor is artistic and moving and the award winning food is sublime. In addition to our ala carte menu, Montebello offers a prix fixe lunch for $25 per person and $35 for dinner.",Italian,40.7604828,-73.9706519,100222 Darbar Grill,"157 East 55th Street New York, NY  10022",//www.google.com/maps/search/?api=1&query=40.7593510%2C-73.968813,316,(212) 751-4600,http://www.darbargrill.com/,Indian,4.5316,4.6,4.5,4.1,4.3,$30 and under,0,5,5,24,66,2 Darbar Grill is a superb choice for Indian food with great ambiance and service.,Indian,40.759341,-73.9688386,10022Gin Parlour - InterContinental New York,"111 East 48th Street New York, NY  10017",//www.google.com/maps/search/?api=1&query=40.7557130%2C-73.974396,50,(212) 755-5900,http://intercontinentalnybarclay.com/dining-gin-bar,Contemporary American,3.75,3.2,3.4,3.3,2.6,$30 and under,0,17,26,22,35,"Gin Parlour is a popular meeting spot for both hotel guests and New Yorkers alike. 

Located off the hotel's elegant Lobby, Gin Parlour is renowned for its outstanding American and Continental cuisine, offering guests a fresh and innovative dining experience. The cuisine combines a simple, elegant presentation with the season's freshest ingredients to create an exciting new approach to light and healthy dining. 

The buzz of New York can be felt each night in the bar, which is the perfect place to relax and unwind after a busy day in the city. Enjoy a cocktail or light meal in the comfortable lounge-like setting.",Contemporary American,40.7556389,-73.9734987,10017Michael Jordan's The Steak House N.Y.C.,"23 Vanderbilt Ave New York, NY  10017",//www.google.com/maps/search/?api=1&query=40.7531000%2C-73.9779,2160,(212) 655-2300,http://www.michaeljordansnyc.com/,Steakhouse,3.9216,3.9,3.8,4,3.6,$31 to $50,3,8,19,38,32,"Situated on the North and West balconies of New York's Grand Central Terminal, this restaurant was designed to reflect Michaels sense of taste and style. Michael Jordan's The Steak House N.Y.C. ranks among the finest steakhouses in Manhattan, offering a world class menu and an extensive, eclectic selection of wines and spirits. There are two private dining rooms and two semi private dining rooms available, with pre-fixe menus. ",Steakhouse,40.753062,-73.9772273,10017Beauty & Essex- New York,"146 Essex Street New York, NY  10002",//www.google.com/maps/search/?api=1&query=40.7203670%2C-73.986774,5452,(212) 614-0146,http://www.beautyandessex.com/,Tapas / Small Plates,4.65452,4.6,4.5,4.7,4.2,$31 to $50,1,2,5,17,75,"From the team behind The Stanton Social comes Beauty & Essex, a grand 10,000 square foot restaurant, bar, & lounge in the heart of the lower east side.The atmosphere of the space is both grand and intimate, moody and effervescent. Various rooms for lounging and dining unfold on two floors, like a large turn-of-the-century townhouse. Each room has its own unique elements that celebrate timeless jewelry designs and upscale jewelry stores.The cuisine is multi-ethnic in inspiration, casually elegant, and designed for sharing at the table among friends and family. Where the Stanton Social""s menu is Chef Chris Santos' take on cocktail party classics and street foods from across the globe, Beauty & Essex is rooted in a bold bistro direction focusing on the reinvention of modern family style dining that is both whimsical and sophisticated.",Other,40.7204209,-73.9868826,10002Mercer Kitchen,"99 Prince Street New York, NY  10012",//www.google.com/maps/search/?api=1&query=40.7248000%2C-73.9988,4598,(212) 966-5454,http://www.themercerkitchen.com/,American,4.54598,4.3,4.1,4.4,3.9,$30 and under,2,3,9,21,65,"Located at the Mercer Hotel, Mercer Kitchen brings a chic, sophisticated vibe to the heart of SoHo. When Mercer Kitchen opened in 1998, it immediately became a destination for New Yorkers, celebrities, and tourists. Situated in the basement of a historic building constructed in the 1800s, the… restaurant was designed by Christian Liaigre as a combination of industrial and classic modernism. Chef Jean-Georges’ American menu features market-driven, seasonal ingredients prepared in a simple yet elegant style, with favorites like the Tuna Spring Roll, Steamed Shrimp Salad, wood-fired pizzas, and classic Warm Valrhona Chocolate Cake. There is an open kitchen, where guests can sit back and watch the show.",American,40.7249587,-73.9987276,10012The Dutch,"131 Sullivan Street New York, NY  10000",//www.google.com/maps/search/?api=1&query=40.7265770%2C-74.002204,2125,(212) 677-6200,http://www.thedutchnyc.com/,American,4.62125,4.5,4.4,4.4,3.9,$31 to $50,1,2,6,19,72,"The Dutch is an American restaurant, bar and oyster room inspired by local cafes, country inns, corner taverns, neighborhood bistros, seaside shacks, roadside joints and the same mix of cultural influences that make New York City great. Award-winning Chef Andrew Carmellini's roots-inspired American menu features fresh fish and shellfish, choice meats, local produce and the best of what's around.",American,40.7265537,-74.0020789,10000Lafayette,"380 Lafayette Street New York, NY  10003",//www.google.com/maps/search/?api=1&query=40.7275520%2C-73.993418,2128,(212) 533-3000,http://www.lafayetteny.com/,French,4.52128,4.4,4.3,4.5,3.9,$31 to $50,2,2,6,21,69,"Lafayette is an everyday French restaurant conducting the spirit of French dining anew in downtown Manhattan’s NoHo neighborhood. Open morning, noon and night, this grand café and bakery is dedicated to Chef Andrew Carmellini's market-driven bistro cooking in a timeless hallmark setting. Our light-flushed dining room features soaring arched windows overlooking the NoHo streetscapes and a lively rotisserie bar. Our corner boulangerie-patisserie is open all hours offering artisanal breads, croissants, Stumptown coffee drinks, a light breakfast or lunch and a host of confections. In warm weather months, our sidewalk cafe opens daily for open air breakfast, lunch, brunch and dinner service.",French,40.7276201,-73.9937785,10003Vandal,"199 Bowery New York, NY  10002",//www.google.com/maps/search/?api=1&query=40.7211380%2C-73.993373,1829,(212) 400-0199,http://www.vandalnewyork.com/,Tapas / Small Plates,4.61829,4.5,4.4,4.7,4.1,$50 and over,1,2,6,20,71,Located at 199 Bowery.,Other,40.7210706,-73.9933815,10002Gotham Bar and Grill,"12 East 12th Street New York, NY  10003",//www.google.com/maps/search/?api=1&query=40.7340000%2C-73.994,8591,(212) 620-4020,http://www.gothambarandgrill.com/,Contemporary American,4.78591,4.7,4.6,4.6,4.2,$50 and over,1,1,4,15,79,"Since first opening its doors in 1984, Gotham Bar and Grill has epitomized New York City dining at its finest, serving Executive Chef Alfred Portale's sublime and refreshingly accessible Contemporary American Cuisine in a dining room that is consistently packed with sophisticated diners from all over the country and the world.One of the secrets of Gotham's success is that it is an institution that has never become institutional. The unparalleled quality of the food and service are constants, but the rest of the Gotham experience is constantly updated to keep the restaurant feeling as fresh as the day it opened. New menu items are introduced each season, the wine list is always evolving, and the dining room is regularly revamped.Gotham Bar and Grill has been honored as Most Outstanding Restaurant in the nation by the James Beard Foundation, which named Chef/Owner Alfred Portale Most Outstanding Chef in the nation for 2006. ",Contemporary American,40.734207,-73.993699,10003Il Buco Alimentari & Vineria,"53 Great Jones St. New York, NY  10012",//www.google.com/maps/search/?api=1&query=40.7264530%2C-73.992549,2011,(212) 837-2622,http://www.ilbucovineria.com/,Italian,4.72011,4.6,4.5,4.5,4.1,$31 to $50,1,2,4,18,75,"Il Buco Alimentari & Vineria is a market, salumeria, bakery and restaurant dedicated to quality products. This ""simple convivial spot that tastes just like Italy"" feels like a ""village inside-a-restaurant"". While the Alimentari sells house made salumi, freshly baked bread and an ample assortment of imported and domestic items, the open kitchen looks out onto a rustic dining room with communal tables and long marble wine bar.  A seasonal menu by Executive Chef Garrison Price features salumi/cheese boards, small sharing plates, fresh pastas and roasted meats and fish from a rotisserie and wood burning oven. The upstairs private dining loft, adjacent to the roof garden and overlooking the main restaurant and market, is available for parties up to 50 people for cocktails and/or a seated dinner. Whole fish under sea salt and roasted short ribs or porchetta are house staples often served family style as are house made gelato tastings.",Italian,40.7264417,-73.9925756,10012Bar Primi,"325 Bowery New York, NY  10003",//www.google.com/maps/search/?api=1&query=40.7256460%2C-73.991812,794,(212) 220-9100,http://www.barprimi.com/,Italian,4.6794,4.6,4.3,4.5,4.1,$30 and under,1,1,6,18,74,"Bar Primi is a corner pasta shop devoted to ‘primi piatti,’ the pasta course. What began as an idea for a small space in New York's East Village has since become an essential in chef and co-owner Andrew Carmellini's range: fresh pasta traditionally prepared and cooked to order.  At Bar Primi, the main course is Primi Piatti. We use a variety of non-GMO semolina and specialty ‘00’ flours, organic eggs and handed-down techniques to create our menu of Traditional and Seasonal pasta dishes. We make more than a dozen different shapes and styles daily. This includes lumache and rigatoni from our imported extruder or ravioli and mezzalune cut and filled by hand.  Family recipes and secrets are traded between Carmellini and Brooklyn-born chef-partner Salvatore Lamboglia who also offers a daily meat or seafood special in addition to a selection of shareable Piccolini and Antipasti, artisanal cheese, salumi and simple home-style desserts.",Italian,40.7257162,-73.9916803,10003Lure New York,"142 Mercer New York, NY  10012",//www.google.com/maps/search/?api=1&query=40.7246000%2C-73.9984,3269,(212) 431-7676,http://www.lurefishbar.com/,Seafood,4.73269,4.7,4.4,4.5,4.1,$31 to $50,1,1,3,16,79,Contemporary American Seafood featuring an extensive raw bar and first class sushi program. The striking design is reminiscent of the interior of an elegant cruise ship. We offer amazing cocktails and a well crafted 250 bottle wine list.,Seafood,40.724703,-73.9983278,10012Nix,"72 University Place New York, NY  10003",//www.google.com/maps/search/?api=1&query=40.7332500%2C-73.993674,1130,(212) 498-9393,http://www.nixny.com/,Vegetarian,4.7113,4.7,4.4,4.5,4.1,$31 to $50,0,1,5,18,76,"Nix is a new restaurant from Michelin-starred chef John Fraser, drawing on his personal passion for cooking with vegetables. The menu features an array of affordable and seasonal dishes, largely sourced from the Union Square Greenmarket, along with an innovative list of cocktails and wines.  Nix is open for dinner nightly, lunch on weekdays and brunch at weekends.",Other,40.7332572,-73.993611,10003Lupa,"170 Thompson Street New York, NY  10012",//www.google.com/maps/search/?api=1&query=40.7276450%2C-74.000328,4526,(212) 982-5089,http://www.luparestaurant.com/,Italian,4.74526,4.6,4.5,4.4,4.3,$31 to $50,1,1,5,15,78,"Lupa specializes in high quality, moderately-priced Roman fare with a New York edge. Lupa is a fun, boisterous and unpretentious trattoria with a warm and welcoming atmosphere.   ",Italian,40.7276574,-74.0000589,10012Claudette,"24 Fifth Avenue New York, NY  10011",//www.google.com/maps/search/?api=1&query=40.7331340%2C-73.995975,987,(212) 868-2424,http://claudettenyc.com/,French,4.6987,4.6,4.4,4.7,4.2,$30 and under,1,1,4,20,74,"Breathing new life into Lower Fifth Avenue, Claudette is an elegant Provençal restaurant steps from Washington Square Park. Opened in May 2014, Claudette joins her sister restaurants Rosemary's, Rosemary's Pizza and Bobo in offering a warm and inviting atmosphere to share great food with friends and family.  Executive Chef Ari Bokovza’s style celebrates the rich flavors of the Mediterranean and Provence while maintaining a respect for individual ingredients. His menu focuses on local produce, seafood and North African aromatics found in the Provençal kitchen. Claudette's cellar highlights the wines of Southern France, with a wide selection of Rose and Chateauneuf du Pape. The bar offers a list of unique aperitifs, cocktails and an extensive vin au verre selection, including rose on tap. ",French,40.7332403,-73.9962714,10011Empellon Taqueria,"230 West 4th New York, NY  10014",//www.google.com/maps/search/?api=1&query=40.7341240%2C-74.003031,1432,(212) 367-0999,http://www.empellon.com/taqueria,Mexican,4.61432,4.5,4.5,4.4,4,$31 to $50,1,2,6,19,72,"Open Dinner & Brunch.  We opened our doors on March 22nd, 2011 with the intention of treating tacos with a high level of respect and serving them in a fun environment.  Which is how I believe tacos should be enjoyed. We designed the menu with the idea that most ingredients worth eating can benefit further by being placed atop a well-made tortilla. We push our kitchen team to explore the ubiquitous flavors that we all love about Mexican cooking in this country as well as the less obvious ones that we all should love. Empellon's approach to cuisine is informed by authenticity but is not limited by it. ",Mexican,40.734142,-74.0030683,10014Perry St,"176 Perry Street New York, NY  10014",//www.google.com/maps/search/?api=1&query=40.7346000%2C-74.0093,3657,(212) 352-1900,http://www.perrystrestaurant.com/,Contemporary American,4.83657,4.7,4.7,4.6,4.3,$31 to $50,1,2,2,11,84,"Chef Jean-Georges brings relaxed elegance to the West Village with Perry St - awarded three stars by the New York Times. Jean-Georges’ son, Cedric Vongerichten, helms the kitchen, creating dishes that reflect his own keen instinct for balancing flavor and texture with an exquisite blend of French, American, and Asian influences and ingredients. The menu is inspired by the season, centering on the local market at Union Square. Please visit us http://www.perrystrestaurant.com for menus and more information.",Contemporary American,40.7344295,-74.0096996,10014Boucherie - West Village,"99 7th Avenue South New York, NY  10014",//www.google.com/maps/search/?api=1&query=40.7330470%2C-74.002877,546,(212) 837-1616,http://boucherie.nyc/,French,4.4546,4.3,4,4.4,3.8,$31 to $50,2,3,10,24,61,"BOUCHERIE is a traditional FRENCH brasserie and steakhouse, celebrating Joie de Vivre in the heart of West Village. Executive Chef Jerome DIHUI, former Chef de Cuisine of Pastis, prepares a menu of French classics and timeless bistro favorites, in addition to the DRY-AGED STEAKS from the wood fired grill. An absinthe-inspired bar offers classic drinks, signature cocktails and craft beers. Located in the building that used to house the prominent Circle Repertory Theater, the 320-seat restaurant provides a diverse array of dining options from the spacious dining room, a seat at the butcher counter, the intimate second-floor gallery with private dining and outdoor cafe.",French,40.7330828,-74.0028776,10014Indochine,"430 Lafayette Street New York, NY  10003",//www.google.com/maps/search/?api=1&query=40.7292410%2C-73.992523,1428,(212) 505-5111,http://indochinenyc.com/,Vietnamese,4.61428,4.6,4.3,4.5,4.1,$50 and over,0,1,7,20,72,"Indochine is a timeless classic that combines stylish ambience, tropical decor, and exotic French-Vietnamese cuisine that is perfect for intimate dinners and private events alike.",Southeast Asian,40.729286,-73.9924838,10003El Vez New York,"259 Vesey Street New York, NY  10282",//www.google.com/maps/search/?api=1&query=40.7143160%2C-74.01514,747,(212) 233-2500,http://www.elveznyc.com/,Mexican,4.6747,4.5,4.4,4.4,4.1,$30 and under,1,2,5,20,72,"Tradition and innovation collide in a whirlwind of sight, sound and sabor at El Vez, STARR Restaurants’ exciting and inviting contribution to Lower Manhattan’s Battery Park City community.Casual yet contemporary, El Vez celebrates the festive soul of Mexican and Mexican-American culture, a true south-of-the-border spirit that manifests itself in the restaurant’s attitude and atmosphere. The breathtaking space is a feast for the eyes with imaginatively designed dining areas, a large bar outfitted with a photobooth, a wrap-around landscaped patio for dining al fresco and a burrito bar for food on the go.  With deep roots in regional Mexican cooking, the menu is built around guacamoles, fundidos, ceviches, tacos, quesadillas and enchiladas made from scratch with authenticity in mind. Meanwhile, the bar offers a large selection of creative cocktails, signature margaritas and staggering selection of 150 mezcals and tequilas.",Mexican,40.7147234,-74.0156345,10282Public Kitchen,"215 Chrystie St New York, NY  10002-1239",//www.google.com/maps/search/?api=1&query=40.7226170%2C-73.99155,298,(212) 273-9403,http://www.publichotels.com/,"Global, International",4.5298,4.4,4.1,4.4,3.9,$31 to $50,2,2,8,19,69,"THE HOTEL’S RESTAURANT BY RENOWNED CHEF JEAN-GEORGES VONGERICHTEN, IS DRIVEN BY THE MARKET AND THE SEASONS, AND INSPIRED BY JEAN-GEORGES’ TRAVELS WORLDWIDE. THE MENU FOCUSES ON SUSTAINABLE SEAFOOD, ORGANIC POULTRY AND GRASS FED MEATS, AS WELL AS USING THE FRESHEST ORGANIC GREEN MARKET FRUITS AND VEGETABLES. CHEF JEAN-GEORGES’ SIGNATURE STYLE AND FLAVORS APPEAR IN ALL DISHES THROUGHOUT THE MENU. IT FEATURES A SMOKER, WOOD-BURNING OVEN AND WOOD BURNING GRILL AS A FOCAL POINT AND HAS A MENU FOR ALL TASTES AND DIETS, INCLUDING VEGAN. THE FOOD AND ENERGETIC SETTING COMPLIMENTS THE FEEL OF THE HOTEL.",Other,40.7231104,-73.9920935,10002Tamarind - Tribeca,"99 Hudson Street New York, NY  10013",//www.google.com/maps/search/?api=1&query=40.7189770%2C-74.008929,2458,(212) 775-9000,http://www.tamarindrestaurantsnyc.com/,Indian,4.72458,4.7,4.6,4.6,4.2,$31 to $50,1,1,4,16,78,"The team from Tamarind, in the Flatiron District, have opened a new restaurant in Tribeca. Tamarind's team of dedicated chef's draw on India's varied regions to take diners on a culinary voyage of the subcontinent. The restaurant's menu includes dishes from Punjab, Hyderabad, Goa, Madras, Lucknow, and Calcutta. India's assertive spices and seasonings distinguish its cooking from all others.",Indian,40.71914,-74.0090339,10013The Stanton Social,"99 Stanton Street New York, NY  10002",//www.google.com/maps/search/?api=1&query=40.7212000%2C-73.9878,5150,(212) 995-0099,http://www.thestantonsocial.com/,Tapas / Small Plates,4.6515,4.5,4.4,4.5,4,$31 to $50,1,3,6,16,74,"Chef/owner Chris Santos has teamed up with Tao owner Richard Wolf, and the James Beard 'Best New Restaurant Design' award winning firm AvroKo, to create The Stanton Social, a staple and neighborhood favorite of the Lower East Side. The design of this three level hot spot tips it's hat to the neighborhood’s garment history and offers diners a culinary odyssey. All menu items are designed for sharing, offering guests a chance to experience multiple dishes and flavors throughout their meal. In addition to its 120 seats, The Stanton Social offers a lounge and bar on the upper level, featuring guest DJs. Dishes range from $9-$30 each.",Other,40.7211375,-73.9881222,10002Hearth,"403 East 12 Street New York, NY  10009",//www.google.com/maps/search/?api=1&query=40.7299800%2C-73.983468,2270,(646) 602-1300,http://restauranthearth.com/,American,4.7227,4.7,4.5,4.6,4.2,$50 and over,0,2,3,17,78,"Hearth is everything the word implies...a warm, comfortable restaurant with hospitality as its goal.  Chef Marco Canora's cuisine employs seasonal, locally-sourced ingredients prepared with an Italian influence.",American,40.7300263,-73.9831883,10009Sarabeth's TriBeCa,"339 Greenwich Street New York, NY  10013",//www.google.com/maps/search/?api=1&query=40.7183450%2C-74.010291,1598,(212) 966-0421,http://www.sarabethsrestaurants.com/,American,4.41598,4.3,4.1,4.2,3.9,$30 and under,1,4,11,24,60,"Sarabeth's is a great place to enjoy breakfast, lunch, brunch or dinner.  Full bar and retail bakery.",American,40.7182443,-74.0102585,10013Leuca,"111 N 12th St Brooklyn, NY  11249",//www.google.com/maps/search/?api=1&query=40.7221200%2C-73.957168,491,(718) 581-5900,http://leuca.com/,Italian,4.6491,4.6,4.3,4.6,4.1,$31 to $50,0,2,6,22,70,"Leuca is a Southern Italian restaurant serving wood-fired dishes in a refined yet casual setting. Located in the heart of Williamsburg, Leuca offers a sophisticated wine and cocktail list meant to pair with a menu of approachable dishes inspired by coastal Italy. ",Italian,40.722293,-73.9566815,11249Sant Ambroeus SoHo,"265 Lafayette Street New York, NY  10012",//www.google.com/maps/search/?api=1&query=40.7234180%2C-73.996567,257,(212) 966-2770,http://www.santambroeus.com/,Italian,4.8257,4.7,4.5,4.6,4.3,$31 to $50,0,1,3,11,85,"At Sant Ambroeus SoHo, guests will enjoy a contemporary interpretation of traditional Milanese cuisine, as well as its branded hospitality in a chic and vibrant atmosphere.An exquisite menu by Milan native, chef Marco Barbisotti, reflects the brand’s culinary vision and historic origins of northern Italy including its signature vitello tonnato, cotoletta alla milanese, and risotti.Sant Ambroeus SoHo offers a robust selection of Italian wines, curated by Sant Ambroeus SoHo’s wine director Jacopo Giustiniani.The high-energy espresso and cappuccino bar at Sant Ambroeus SoHo is open all day. From delicate and smooth to rich and bold offerings, coffee lovers will enjoy unique blends of the highest quality coffee to accompany our desserts, including cornetti, gelato, cakes and cookies.",Italian,40.7234755,-73.9964322,10012